{
  "@context": [
    "http://www.w3.org/ns/anno.jsonld",
    {
      "marq": "https://github.com/jimbarritt/marq/blob/main/doc/comments-design.md#"
    }
  ],
  "body": {
    "format": "text/markdown",
    "type": "TextualBody",
    "value": "This intro line could name the platform version."
  },
  "created": "2026-09-29T10:20:41Z",
  "creator": {
    "email": "mailto:jim@example.com",
    "name": "Jim",
    "type": "Person"
  },
  "generator": {
    "name": "marq-comments 0.1.0",
    "type": "Software"
  },
  "id": "urn:uuid:38a9c1e7-2158-4da2-84b9-0ceea4ed7eb8",
  "motivation": "commenting",
  "target": {
    "marq:sourceBlob": "a6d9e38c431206428083ad87c7b6b39ee26facb7",
    "selector": [
      {
        "conformsTo": "http://tools.ietf.org/rfc/rfc5147",
        "type": "FragmentSelector",
        "value": "line=2,3"
      },
      {
        "exact": "This is a test document for **Marq**, a macOS markdown viewer.",
        "prefix": "s/logo.svg) Marq Test Document\n\n",
        "suffix": "\n\n## Contents\n\nEvery entry below",
        "type": "TextQuoteSelector"
      },
      {
        "end": 112,
        "start": 50,
        "type": "TextPositionSelector"
      }
    ],
    "source": "example-docs/test.md"
  },
  "type": "Annotation"
}
