{
  "@context": [
    "http://www.w3.org/ns/anno.jsonld",
    {
      "marq": "https://github.com/jimbarritt/marq/blob/main/doc/comments-design.md#"
    }
  ],
  "body": {
    "format": "text/markdown",
    "type": "TextualBody",
    "value": "Agreed, leave it."
  },
  "created": "2026-09-29T10:44:55Z",
  "creator": {
    "email": "mailto:jim@example.com",
    "name": "Jim",
    "type": "Person"
  },
  "generator": {
    "name": "marq-comments 0.1.0",
    "type": "Software"
  },
  "id": "urn:uuid:f8bcc963-2d7a-49ad-9623-96e0dae98023",
  "motivation": "replying",
  "target": "urn:uuid:5782b186-87e6-4f8a-882f-c32d2db5b196",
  "type": "Annotation"
}
